{
  "$schema":"https://json-schema.org/draft/2020-12/schema",
  "$id":"https://schemas.truaxiom.llc/tip/capability-manifest/v1",
  "title":"TIP Capability Manifest",
  "type":"object",
  "additionalProperties":false,
  "required":["capability_id","name","version","description","inputs","outputs","required_permissions","risk_tier","tags"],
  "properties":{
    "capability_id":{"type":"string","minLength":1},
    "name":{"type":"string","minLength":1},
    "version":{"type":"string","minLength":1},
    "description":{"type":"string","minLength":1},
    "inputs":{"type":"array","items":{"type":"string"},"uniqueItems":true},
    "outputs":{"type":"array","items":{"type":"string"},"uniqueItems":true},
    "required_permissions":{"type":"array","items":{"type":"string"},"uniqueItems":true},
    "risk_tier":{"type":"string","enum":["low","medium","high","critical"]},
    "tags":{"type":"array","items":{"type":"string"},"uniqueItems":true}
  }
}